[
  {
    "question_id": "N-A1-001",
    "type": "A1",
    "stem": "缺血性脑卒中最常见的病因是下列哪一项？",
    "options": {
      "A": "大动脉粥样硬化性血栓形成所致",
      "B": "脑动静脉畸形血管破裂所致",
      "C": "淀粉样脑血管病出血所致",
      "D": "蛛网膜下腔动脉瘤破裂",
      "E": "脑静脉窦血栓形成所致"
    },
    "answer": "A",
    "analysis": "缺血性脑卒中以大动脉粥样硬化性血栓形成最常见。",
    "module": "M1",
    "bloom_level": "记忆"
  },
  {
    "question_id": "N-A1-002",
    "type": "A1",
    "stem": "脑出血最好发部位是下列哪一项？",
    "options": {
      "A": "基底节区壳核（大脑中动脉深穿支）",
      "B": "丘脑（大脑后动脉深穿支）",
      "C": "脑桥（基底动脉旁正中支）",
      "D": "小脑（小脑上动脉）",
      "E": "脑叶（皮质下白质）"
    },
    "answer": "A",
    "analysis": "基底节区壳核出血最常见。",
    "module": "M1",
    "bloom_level": "记忆"
  },
  {
    "question_id": "N-A1-003",
    "type": "A1",
    "stem": "蛛网膜下腔出血首选的检查是？",
    "options": {
      "A": "头颅CT平扫",
      "B": "头颅MRI平扫",
      "C": "脑电图检查",
      "D": "经颅多普勒",
      "E": "腰穿脑脊液"
    },
    "answer": "A",
    "module": "M1",
    "bloom_level": "理解",
    "analysis": "蛛网膜下腔出血首选头颅 CT 平扫，敏感性高且快速。"
  }
]